number,value,datetime_start,datetime_complete,duration,params_Na,params_batch_momentum,params_gamma,params_lambda_sparse,params_norm_type,params_num_groups,state
0,0.019934044490522478,2020-11-25 22:16:15.985808,2020-11-25 22:23:21.497115,0 days 00:07:05.511307,32.0,0.95,1.0,1e-06,batch,-1.0,COMPLETE
1,0.020245078962073327,2020-11-25 22:23:21.526038,2020-11-25 22:30:34.017451,0 days 00:07:12.491413,64.0,0.95,1.0,1e-06,batch,-1.0,COMPLETE
2,0.0203682498236843,2020-11-25 22:30:34.043382,2020-11-25 22:38:03.689085,0 days 00:07:29.645703,64.0,0.95,1.5,0.0001,group,1.0,COMPLETE
3,0.020260703724945105,2020-11-25 22:38:03.710030,2020-11-25 22:45:13.750563,0 days 00:07:10.040533,64.0,0.98,1.5,0.001,batch,4.0,COMPLETE
4,0.02037026143131802,2020-11-25 22:45:13.774500,2020-11-25 22:52:36.648297,0 days 00:07:22.873797,16.0,0.98,1.2,0.01,group,2.0,COMPLETE
5,0.01978011230296955,2020-11-25 22:52:36.673231,2020-11-25 22:59:40.015458,0 days 00:07:03.342227,16.0,0.95,1.5,0.1,batch,-1.0,COMPLETE
6,0.01978011230296955,2020-11-25 22:59:40.040392,2020-11-25 23:06:47.807697,0 days 00:07:07.767305,16.0,0.95,2.0,1e-06,batch,5.0,COMPLETE
7,0.020563065193155896,2020-11-25 23:06:47.834625,2020-11-25 23:14:33.934891,0 days 00:07:46.100266,128.0,0.9,1.2,0.0,group,-1.0,COMPLETE
8,0.019793368257870564,2020-11-25 23:14:33.961819,2020-11-25 23:21:37.180924,0 days 00:07:03.219105,16.0,0.98,1.0,0.1,batch,3.0,COMPLETE
9,0.019934044490522478,2020-11-25 23:21:37.205857,2020-11-25 23:28:50.438134,0 days 00:07:13.232277,32.0,0.95,1.0,1e-06,batch,-1.0,COMPLETE
10,0.02020942632129812,2020-11-25 23:28:50.469051,2020-11-25 23:35:44.264528,0 days 00:06:53.795477,8.0,0.9,1.5,0.1,batch,2.0,COMPLETE
11,0.019905105024646923,2020-11-25 23:35:44.288464,2020-11-25 23:42:41.942034,0 days 00:06:57.653570,24.0,0.95,2.0,0.1,batch,5.0,COMPLETE
12,0.01978011230296955,2020-11-25 23:42:41.971954,2020-11-25 23:49:43.934222,0 days 00:07:01.962268,16.0,0.95,2.0,0.001,batch,5.0,COMPLETE
13,0.01978011230296955,2020-11-25 23:49:43.957160,2020-11-25 23:56:45.542277,0 days 00:07:01.585117,16.0,0.95,2.0,0.0,batch,5.0,COMPLETE
14,0.01978011230296955,2020-11-25 23:56:45.567211,2020-11-26 00:03:44.055929,0 days 00:06:58.488718,16.0,0.95,2.0,0.0001,batch,4.0,COMPLETE
15,0.01990586651445863,2020-11-26 00:03:44.084852,2020-11-26 00:10:45.279047,0 days 00:07:01.194195,24.0,0.9,1.5,0.01,batch,3.0,COMPLETE
16,0.01978011230296955,2020-11-26 00:10:45.300989,2020-11-26 00:17:50.190511,0 days 00:07:04.889522,16.0,0.95,2.0,0.1,batch,1.0,COMPLETE
17,0.020563065193155896,2020-11-26 00:17:50.211455,2020-11-26 00:25:45.654906,0 days 00:07:55.443451,128.0,0.95,2.0,0.0001,group,1.0,COMPLETE
18,0.01978011230296955,2020-11-26 00:25:45.682281,2020-11-26 00:32:48.219226,0 days 00:07:02.536945,16.0,0.95,2.0,0.0,batch,4.0,COMPLETE
19,0.020209569234243996,2020-11-26 00:32:48.246154,2020-11-26 00:39:44.818277,0 days 00:06:56.572123,8.0,0.95,2.0,0.0,batch,4.0,COMPLETE
20,0.020527843673584897,2020-11-26 00:39:44.842213,2020-11-26 00:47:02.133698,0 days 00:07:17.291485,16.0,0.9,2.0,0.0001,group,1.0,COMPLETE
21,0.01978011230296955,2020-11-26 00:47:02.162621,2020-11-26 00:54:02.047871,0 days 00:06:59.885250,16.0,0.95,2.0,0.0,batch,4.0,COMPLETE
22,0.01978011230296955,2020-11-26 00:54:02.078788,2020-11-26 01:01:06.711312,0 days 00:07:04.632524,16.0,0.95,2.0,0.0,batch,4.0,COMPLETE
23,0.01978011230296955,2020-11-26 01:01:06.738241,2020-11-26 01:08:09.082208,0 days 00:07:02.343967,16.0,0.95,2.0,0.0,batch,4.0,COMPLETE
24,0.01978011230296955,2020-11-26 01:08:09.111130,2020-11-26 01:15:11.829346,0 days 00:07:02.718216,16.0,0.95,2.0,0.0,batch,4.0,COMPLETE
25,0.019793368257870564,2020-11-26 01:15:11.855277,2020-11-26 01:22:17.162738,0 days 00:07:05.307461,16.0,0.98,2.0,0.001,batch,5.0,COMPLETE
26,0.020209569234243996,2020-11-26 01:22:17.196648,2020-11-26 01:29:21.466818,0 days 00:07:04.270170,8.0,0.95,1.2,0.001,batch,4.0,COMPLETE
27,0.019934044490522478,2020-11-26 01:29:21.491751,2020-11-26 01:36:34.598879,0 days 00:07:13.107128,32.0,0.95,2.0,0.0,batch,5.0,COMPLETE
28,0.019757949739754987,2020-11-26 01:36:34.622814,2020-11-26 01:44:01.620631,0 days 00:07:26.997817,128.0,0.95,2.0,0.0,batch,4.0,COMPLETE
29,0.019757949739754987,2020-11-26 01:44:01.651548,2020-11-26 01:51:24.774120,0 days 00:07:23.122572,128.0,0.95,2.0,0.0,batch,4.0,COMPLETE
30,0.019757949739754987,2020-11-26 01:51:24.800052,2020-11-26 01:58:56.043891,0 days 00:07:31.243839,128.0,0.95,2.0,0.0,batch,4.0,COMPLETE
31,0.019757949739754987,2020-11-26 01:58:56.065833,2020-11-26 02:06:24.121788,0 days 00:07:28.055955,128.0,0.95,2.0,0.0001,batch,4.0,COMPLETE
32,0.019757949739754987,2020-11-26 02:06:24.149713,2020-11-26 02:13:54.596325,0 days 00:07:30.446612,128.0,0.95,2.0,0.0,batch,4.0,COMPLETE
33,0.019757949739754987,2020-11-26 02:13:54.620261,2020-11-26 02:21:24.929236,0 days 00:07:30.308975,128.0,0.95,2.0,0.0,batch,4.0,COMPLETE
34,0.019757949739754987,2020-11-26 02:21:24.958159,2020-11-26 02:28:47.541059,0 days 00:07:22.582900,128.0,0.95,1.0,0.0001,batch,4.0,COMPLETE
35,0.019757949739754987,2020-11-26 02:28:47.563998,2020-11-26 02:36:14.118276,0 days 00:07:26.554278,128.0,0.95,1.0,0.0001,batch,4.0,COMPLETE
36,0.020562030910772792,2020-11-26 02:36:14.144207,2020-11-26 02:44:04.645767,0 days 00:07:50.501560,128.0,0.98,1.0,0.0001,group,2.0,COMPLETE
37,0.019757949739754987,2020-11-26 02:44:04.673693,2020-11-26 02:51:24.849171,0 days 00:07:20.175478,128.0,0.95,1.0,0.0001,batch,4.0,COMPLETE
38,0.019757949739754987,2020-11-26 02:51:24.878094,2020-11-26 02:58:40.148407,0 days 00:07:15.270313,128.0,0.95,1.0,0.0001,batch,4.0,COMPLETE
39,0.020260703724945105,2020-11-26 02:58:40.173340,2020-11-26 03:05:49.252725,0 days 00:07:09.079385,64.0,0.98,1.0,0.0001,batch,3.0,COMPLETE
40,0.020378105296544522,2020-11-26 03:05:49.281647,2020-11-26 03:13:34.972724,0 days 00:07:45.691077,128.0,0.95,1.0,0.0001,group,4.0,COMPLETE
41,0.019757949739754987,2020-11-26 03:13:35.000649,2020-11-26 03:20:53.042646,0 days 00:07:18.041997,128.0,0.95,1.2,0.01,batch,4.0,COMPLETE
42,0.019757949739754987,2020-11-26 03:20:53.071568,2020-11-26 03:28:18.390497,0 days 00:07:25.318929,128.0,0.95,1.0,0.01,batch,4.0,COMPLETE
43,0.019757949739754987,2020-11-26 03:28:18.417425,2020-11-26 03:35:41.429484,0 days 00:07:23.012059,128.0,0.95,1.0,0.0001,batch,4.0,COMPLETE
44,0.019757949739754987,2020-11-26 03:35:41.452424,2020-11-26 03:43:07.641358,0 days 00:07:26.188934,128.0,0.95,1.0,0.01,batch,-1.0,COMPLETE
45,0.019757949739754987,2020-11-26 03:43:07.667289,2020-11-26 03:50:29.758727,0 days 00:07:22.091438,128.0,0.95,1.0,0.01,batch,-1.0,COMPLETE
46,0.019749861883769745,2020-11-26 03:50:29.789644,2020-11-26 03:57:51.389685,0 days 00:07:21.600041,128.0,0.9,1.5,0.01,batch,-1.0,COMPLETE
47,0.02023946207147192,2020-11-26 03:57:51.416614,2020-11-26 04:05:04.186412,0 days 00:07:12.769798,64.0,0.9,1.5,0.01,batch,-1.0,COMPLETE
48,0.01990586651445863,2020-11-26 04:05:04.210349,2020-11-26 04:12:21.275913,0 days 00:07:17.065564,24.0,0.9,1.5,1e-06,batch,-1.0,COMPLETE
49,0.01993324289447868,2020-11-26 04:12:21.301844,2020-11-26 04:19:33.982441,0 days 00:07:12.680597,32.0,0.9,1.5,0.0,batch,2.0,COMPLETE
50,0.019749861883769745,2020-11-26 04:19:34.009369,2020-11-26 04:27:25.005376,0 days 00:07:50.996007,128.0,0.9,1.5,1e-06,batch,-1.0,COMPLETE
51,0.019749861883769745,2020-11-26 04:27:25.197890,2020-11-26 04:38:34.290993,0 days 00:11:09.093103,128.0,0.9,1.5,1e-06,batch,-1.0,COMPLETE
52,0.019749861883769745,2020-11-26 04:38:34.381751,2020-11-26 04:50:06.899242,0 days 00:11:32.517491,128.0,0.9,1.5,1e-06,batch,-1.0,COMPLETE
53,0.019749861883769745,2020-11-26 04:50:06.983018,2020-11-26 05:10:37.117656,0 days 00:20:30.134638,128.0,0.9,1.5,1e-06,batch,-1.0,COMPLETE
54,0.019749861883769745,2020-11-26 05:10:37.351032,2020-11-26 05:36:22.674545,0 days 00:25:45.323513,128.0,0.9,1.5,1e-06,batch,-1.0,COMPLETE
55,0.019749861883769745,2020-11-26 05:36:22.988705,2020-11-26 06:11:09.150409,0 days 00:34:46.161704,128.0,0.9,1.5,1e-06,batch,-1.0,COMPLETE
56,0.019749861883769745,2020-11-26 06:11:09.569289,2020-11-26 07:05:56.811616,0 days 00:54:47.242327,128.0,0.9,1.5,1e-06,batch,-1.0,COMPLETE
57,0.019749861883769745,2020-11-26 07:05:57.505760,2020-11-26 08:03:30.236288,0 days 00:57:32.730528,128.0,0.9,1.5,1e-06,batch,-1.0,COMPLETE
58,0.020550816147578903,2020-11-26 08:03:30.935419,2020-11-26 09:01:25.382698,0 days 00:57:54.447279,24.0,0.9,1.5,1e-06,group,-1.0,COMPLETE
59,0.02020942632129812,2020-11-26 09:01:26.084565,2020-11-26 09:57:11.738478,0 days 00:55:45.653913,8.0,0.9,1.5,1e-06,batch,-1.0,COMPLETE
60,0.019749861883769745,2020-11-26 09:57:12.379764,2020-11-26 10:49:58.409573,0 days 00:52:46.029809,128.0,0.9,1.5,1e-06,batch,-1.0,COMPLETE
61,0.019749861883769745,2020-11-26 10:49:58.995008,2020-11-26 11:45:34.957577,0 days 00:55:35.962569,128.0,0.9,1.5,1e-06,batch,-1.0,COMPLETE
62,0.019749861883769745,2020-11-26 11:45:35.600082,2020-11-26 12:39:54.617561,0 days 00:54:19.017479,128.0,0.9,1.5,1e-06,batch,-1.0,COMPLETE
63,0.019749861883769745,2020-11-26 12:39:55.382516,2020-11-26 13:34:52.752812,0 days 00:54:57.370296,128.0,0.9,1.5,1e-06,batch,-1.0,COMPLETE
64,0.019749861883769745,2020-11-26 13:34:53.447975,2020-11-26 14:29:22.791799,0 days 00:54:29.343824,128.0,0.9,1.5,1e-06,batch,-1.0,COMPLETE
65,0.01993324289447868,2020-11-26 14:29:23.446068,2020-11-26 15:24:22.122808,0 days 00:54:58.676740,32.0,0.9,1.5,1e-06,batch,-1.0,COMPLETE
66,,2020-11-26 15:24:22.841414,,,,,,,,,RUNNING
